Posição,Nome Competidor,ID Competidor,Nacionalidade,1Q,2Q,3Q,4Q,5Q,6Q,7Q,8Q,Total,Nett
1,"DANIEL NYBORG, NIKOLAJ HOFFMANN BUHL",1027,DEN,1.0,1.0,1.0,(4.0),1.0,1.0,1.0,1.0,11.0,7.0
2,"KRISTIAN PRAEST, MARCUS LANGAGERGAARD",2628,,3.0,2.0,3.0,1.0,(7.0),7.0,4.0,3.0,30.0,23.0
3,"CARL EMIL SLOTH, SIMON CHRISTOFFERSEN",730,DEN,2.0,4.0,4.0,(9.0),4.0,5.0,3.0,5.0,36.0,27.0
4,"JENS-CHRISTIAN DEH, N-TOFTEHOJ, MADS FUGLBJERG",2176,,4.0,3.0,2.0,5.0,6.0,6.0,(8.0),4.0,38.0,30.0
5,"GUSTAV AASHOLM BRADLEY, FREDERIK RAGAN MELBYE",1754,,(10.0),10.0,10.0,2.0,3.0,4.0,2.0,2.0,43.0,33.0
6,"LOKE IDRISS KISE, LAURITZ SCHMIDT",2865,,5.0,6.0,(10.0),3.0,5.0,3.0,5.0,6.0,43.0,33.0
7,"MALTHE EBDRUP, CLEMENT AASHOLM-BRADLEY",3041,DEN,6.0,5.0,(10.0),6.0,2.0,2.0,6.0,7.0,44.0,34.0
8,"BERTRAM RADICH, JONATHAN WEIMANN",552,,(10.0),10.0,10.0,8.0,8.0,9.0,7.0,8.0,70.0,60.0
9,"NICKLAS HOJEGAARD, VICTOR LOMHOLT",3655,,(10.0),10.0,10.0,7.0,9.0,8.0,9.0,9.0,72.0,62.0
